Sheet: Sheet1
A1: Started | B1: 2018-10-13
A2: Ending | B2: 2019-01-15
A3: Goal | B3: 120000
A5: Account | B5: Date | C5: Days in | D5: Count | E5: Amount | F5: Currency | G5: Change | H5: EUR | I5: USD
A6: RiseupLabs | B6: 2018-11-12 | C6: of:=[.B6]-[.B$1] -> 30 | E6: of:=12825+4773 -> 17598 | F6: USD | G6: 0.88791 | H6: of:=[.E6]*[.G6] -> 15625.44018 | I6: of:=[.H6]/[.G6] -> 17598 | J6: https://www.xe.com/currencycharts/?from=USD&to=EUR
A7: CCT | B7: 2018-11-13 | C7: of:=[.B7]-[.B$1] -> 31 | D7: 74 | E7: 2868.8 | F7: EUR | G7: 1 | H7: of:=[.E7]*[.G7] -> 2868.8 | I7: of:=[.H7]/[.G6] -> 3230.95809259947
A8: Bitcoin | B8: 2018-11-15 | C8: of:=[.B8]-[.B$1] -> 33 | D8: of:=[BTC.E233] -> 232 | E8: of:=[BTC.D233] -> 1.66600174 | F8: BTC | G8: 4839 | H8: of:=[.E8]*[.G8] -> 8061.78241986 | I8: of:=[.H8]/[.G6] -> 9079.5040261513 | J8: https://bitcoincharts.com/markets/krakenEUR.html
A9: Last updated | B9: of:=MAX([.B6:.B8]) -> 2018-11-15 | H9: of:=SUM([.H6:.H8]) -> 26556.02259986 | I9: of:=[.H9]/[.G6] -> 29908.4621187508 | J9: of:=[.H9]/[.B3] -> 0.221300188332167
A10: Remaining | B10: of:=[.B2]-[.B9] -> 61

Sheet: BTC
A1: 2018-10-13 | B1: PT02H16M57S | C1: 1BvBMSEYstWetqTFn5Au4m4GFg7xJaNVN2 | D1: 0.003 | E1: 0
A2: 2018-10-13 | B2: PT03H10M15S | C2: 1BvBMSEYstWetqTFn5Au4m4GFg7xJaNVN2 | D2: 0.00086832 | E2: 0
A3: 2018-10-13 | B3: PT03H11M50S | C3: 1BvBMSEYstWetqTFn5Au4m4GFg7xJaNVN2 | D3: 0.00041 | E3: 0
A4: 2018-10-13 | B4: PT03H43M34S | C4: 1BvBMSEYstWetqTFn5Au4m4GFg7xJaNVN2 | D4: 0.00161952 | E4: 0
A5: 2018-10-13 | B5: PT04H08M45S | C5: 1BvBMSEYstWetqTFn5Au4m4GFg7xJaNVN2 | D5: 0.00159492 | E5: 0
A6: 2018-10-13 | B6: PT04H08M48S | C6: 1BvBMSEYstWetqTFn5Au4m4GFg7xJaNVN2 | D6: 0.00161 | E6: 0
A7: 2018-10-13 | B7: PT04H59M43S | C7: 1BvBMSEYstWetqTFn5Au4m4GFg7xJaNVN2 | D7: 0.04777985 | E7: 0
A8: 2018-10-13 | B8: PT04H59M49S | C8: 1BvBMSEYstWetqTFn5Au4m4GFg7xJaNVN2 | D8: 0.0029 | E8: 0
A9: 2018-10-13 | B9: PT05H42M17S | C9: 1BvBMSEYstWetqTFn5Au4m4GFg7xJaNVN2 | D9: 0.00161291 | E9: 0
A10: 2018-10-13 | B10: PT06H27M07S | C10: 1BvBMSEYstWetqTFn5Au4m4GFg7xJaNVN2 | D10: 0.001 | E10: 0
A11: 2018-10-13 | B11: PT06H52M22S | C11: 1BvBMSEYstWetqTFn5Au4m4GFg7xJaNVN2 | D11: 0.001 | E11: 0
A12: 2018-10-13 | B12: PT08H16M05S | C12: 1BvBMSEYstWetqTFn5Au4m4GFg7xJaNVN2 | D12: 0.00092752 | E12: 0
A13: 2018-10-13 | B13: PT09H49M08S | C13: 1BvBMSEYstWetqTFn5Au4m4GFg7xJaNVN2 | D13: 0.02 | E13: 0
A14: 2018-10-13 | B14: PT10H15M33S | C14: 1BvBMSEYstWetqTFn5Au4m4GFg7xJaNVN2 | D14: 0.0046 | E14: 0
A15: 2018-10-13 | B15: PT10H54M15S | C15: 1BvBMSEYstWetqTFn5Au4m4GFg7xJaNVN2 | D15: 0.004 | E15: 0
A16: 2018-10-13 | B16: PT11H48M05S | C16: 1BvBMSEYstWetqTFn5Au4m4GFg7xJaNVN2 | D16: 0.01 | E16: 0
A17: 2018-10-13 | B17: PT12H27M34S | C17: 1BvBMSEYstWetqTFn5Au4m4GFg7xJaNVN2 | D17: 0.015 | E17: 0
A18: 2018-10-13 | B18: PT12H50M40S | C18: 1BvBMSEYstWetqTFn5Au4m4GFg7xJaNVN2 | D18: 0.00073 | E18: 0
A19: 2018-10-13 | B19: PT12H54M30S | C19: 1BvBMSEYstWetqTFn5Au4m4GFg7xJaNVN2 | D19: 0.002 | E19: 0
A20: 2018-10-13 | B20: PT13H34M53S | C20: 1BvBMSEYstWetqTFn5Au4m4GFg7xJaNVN2 | D20: 0.000925 | E20: 0
A21: 2018-10-13 | B21: PT13H47M49S | C21: 1BvBMSEYstWetqTFn5Au4m4GFg7xJaNVN2 | D21: 0.0016 | E21: 0
A22: 2018-10-13 | B22: PT14H18M52S | C22: 1BvBMSEYstWetqTFn5Au4m4GFg7xJaNVN2 | D22: 0.01613687 | E22: 0
A23: 2018-10-13 | B23: PT14H20M10S | C23: 1BvBMSEYstWetqTFn5Au4m4GFg7xJaNVN2 | D23: 0.0027661 | E23: 0
A24: 2018-10-13 | B24: PT14H37M06S | C24: 1BvBMSEYstWetqTFn5Au4m4GFg7xJaNVN2 | D24: 0.0006 | E24: 0
A25: 2018-10-13 | B25: PT17H50M43S | C25: 1BvBMSEYstWetqTFn5Au4m4GFg7xJaNVN2 | D25: 0.00402 | E25: 0
A26: 2018-10-13 | B26: PT18H18M46S | C26: 1BvBMSEYstWetqTFn5Au4m4GFg7xJaNVN2 | D26: 0.00397997 | E26: 0
A27: 2018-10-13 | B27: PT18H39M14S | C27: 1BvBMSEYstWetqTFn5Au4m4GFg7xJaNVN2 | D27: 0.0420174 | E27: 0
A28: 2018-10-13 | B28: PT19H15M12S | C28: 1BvBMSEYstWetqTFn5Au4m4GFg7xJaNVN2 | D28: 0.00371044 | E28: 0
A29: 2018-10-13 | B29: PT19H26M02S | C29: 1BvBMSEYstWetqTFn5Au4m4GFg7xJaNVN2 | D29: 0.05 | E29: 0
A30: 2018-10-13 | B30: PT19H40M27S | C30: 1BvBMSEYstWetqTFn5Au4m4GFg7xJaNVN2 | D30: 0.03183635 | E30: 0
A31: 2018-10-13 | B31: PT19H51M56S | C31: 1BvBMSEYstWetqTFn5Au4m4GFg7xJaNVN2 | D31: 0.002362 | E31: 0
A32: 2018-10-13 | B32: PT19H54M18S | C32: 1BvBMSEYstWetqTFn5Au4m4GFg7xJaNVN2 | D32: 0.002 | E32: 0
A33: 2018-10-13 | B33: PT20H30M27S | C33: 1BvBMSEYstWetqTFn5Au4m4GFg7xJaNVN2 | D33: 0.00079916 | E33: 0
A34: 2018-10-13 | B34: PT21H15M21S | C34: 1BvBMSEYstWetqTFn5Au4m4GFg7xJaNVN2 | D34: 0.0015 | E34: 0
A35: 2018-10-13 | B35: PT21H44M13S | C35: 1BvBMSEYstWetqTFn5Au4m4GFg7xJaNVN2 | D35: 0.0016 | E35: 0
A36: 2018-10-13 | B36: PT21H52M50S | C36: 1BvBMSEYstWetqTFn5Au4m4GFg7xJaNVN2 | D36: 0.002 | E36: 0
A37: 2018-10-13 | B37: PT23H45M38S | C37: 1BvBMSEYstWetqTFn5Au4m4GFg7xJaNVN2 | D37: 0.01613 | E37: 0
A38: 2018-10-14 | B38: PT00H24M19S | C38: 1BvBMSEYstWetqTFn5Au4m4GFg7xJaNVN2 | D38: 0.00125801 | E38: 0
A39: 2018-10-14 | B39: PT03H27M11S | C39: 1BvBMSEYstWetqTFn5Au4m4GFg7xJaNVN2 | D39: 0.01744236 | E39: 0
A40: 2018-10-14 | B40: PT03H44M05S | C40: 1BvBMSEYstWetqTFn5Au4m4GFg7xJaNVN2 | D40: 0.001 | E40: 0
A41: 2018-10-14 | B41: PT03H46M56S | C41: 1BvBMSEYstWetqTFn5Au4m4GFg7xJaNVN2 | D41: 0.003 | E41: 0
A42: 2018-10-14 | B42: PT03H57M08S | C42: 1BvBMSEYstWetqTFn5Au4m4GFg7xJaNVN2 | D42: 0.015 | E42: 0
A43: 2018-10-14 | B43: PT05H15M52S | C43: 1BvBMSEYstWetqTFn5Au4m4GFg7xJaNVN2 | D43: 0.001593 | E43: 0
A44: 2018-10-14 | B44: PT07H31M22S | C44: 1BvBMSEYstWetqTFn5Au4m4GFg7xJaNVN2 | D44: 0.0015 | E44: 0
A45: 2018-10-14 | B45: PT07H31M56S | C45: 1BvBMSEYstWetqTFn5Au4m4GFg7xJaNVN2 | D45: 0.001 | E45: 0
A46: 2018-10-14 | B46: PT08H16M23S | C46: 1BvBMSEYstWetqTFn5Au4m4GFg7xJaNVN2 | D46: 0.002 | E46: 0
A47: 2018-10-14 | B47: PT08H17M32S | C47: 1BvBMSEYstWetqTFn5Au4m4GFg7xJaNVN2 | D47: 0.002 | E47: 0
A48: 2018-10-14 | B48: PT08H57M08S | C48: 1BvBMSEYstWetqTFn5Au4m4GFg7xJaNVN2 | D48: 0.00182488 | E48: 0
A49: 2018-10-14 | B49: PT11H01M55S | C49: 1BvBMSEYstWetqTFn5Au4m4GFg7xJaNVN2 | D49: 0.00112523 | E49: 0
A50: 2018-10-14 | B50: PT11H31M50S | C50: 1BvBMSEYstWetqTFn5Au4m4GFg7xJaNVN2 | D50: 0.00795055 | E50: 0
A51: 2018-10-14 | B51: PT11H51M43S | C51: 1BvBMSEYstWetqTFn5Au4m4GFg7xJaNVN2 | D51: 0.01 | E51: 0
A52: 2018-10-14 | B52: PT13H06M09S | C52: 1BvBMSEYstWetqTFn5Au4m4GFg7xJaNVN2 | D52: 0.00325596 | E52: 0
A53: 2018-10-14 | B53: PT14H02M09S | C53: 1BvBMSEYstWetqTFn5Au4m4GFg7xJaNVN2 | D53: 0.001 | E53: 0
A54: 2018-10-14 | B54: PT14H09M35S | C54: 1BvBMSEYstWetqTFn5Au4m4GFg7xJaNVN2 | D54: 0.00104352 | E54: 0
A55: 2018-10-14 | B55: PT14H40M03S | C55: 1BvBMSEYstWetqTFn5Au4m4GFg7xJaNVN2 | D55: 0.00258504 | E55: 0
A56: 2018-10-14 | B56: PT15H37M00S | C56: 1BvBMSEYstWetqTFn5Au4m4GFg7xJaNVN2 | D56: 0.00161 | E56: 0
A57: 2018-10-14 | B57: PT15H46M46S | C57: 1BvBMSEYstWetqTFn5Au4m4GFg7xJaNVN2 | D57: 0.00051256 | E57: 0
A58: 2018-10-14 | B58: PT16H05M53S | C58: 1BvBMSEYstWetqTFn5Au4m4GFg7xJaNVN2 | D58: 0.025 | E58: 0
A59: 2018-10-14 | B59: PT17H36M04S | C59: 1BvBMSEYstWetqTFn5Au4m4GFg7xJaNVN2 | D59: 0.00092798 | E59: 0
A60: 2018-10-14 | B60: PT18H55M19S | C60: 1BvBMSEYstWetqTFn5Au4m4GFg7xJaNVN2 | D60: 0.00054637 | E60: 0
A61: 2018-10-14 | B61: PT19H20M28S | C61: 1BvBMSEYstWetqTFn5Au4m4GFg7xJaNVN2 | D61: 0.0033 | E61: 0
A62: 2018-10-14 | B62: PT20H30M51S | C62: 1BvBMSEYstWetqTFn5Au4m4GFg7xJaNVN2 | D62: 0.00085 | E62: 0
A63: 2018-10-14 | B63: PT20H31M10S | C63: 1BvBMSEYstWetqTFn5Au4m4GFg7xJaNVN2 | D63: 0.00059564 | E63: 0
A64: 2018-10-14 | B64: PT20H41M08S | C64: 1BvBMSEYstWetqTFn5Au4m4GFg7xJaNVN2 | D64: 0.002388 | E64: 0
A65: 2018-10-14 | B65: PT21H34M04S | C65: 1BvBMSEYstWetqTFn5Au4m4GFg7xJaNVN2 | D65: 0.00215843 | E65: 0
A66: 2018-10-15 | B66: PT03H17M11S | C66: 1BvBMSEYstWetqTFn5Au4m4GFg7xJaNVN2 | D66: 0.00242 | E66: 0
A67: 2018-10-15 | B67: PT04H07M41S | C67: 1BvBMSEYstWetqTFn5Au4m4GFg7xJaNVN2 | D67: 0.00096569 | E67: 0
A68: 2018-10-15 | B68: PT04H18M50S | C68: 1BvBMSEYstWetqTFn5Au4m4GFg7xJaNVN2 | D68: 0.00148934 | E68: 0
A69: 2018-10-15 | B69: PT07H16M11S | C69: 1BvBMSEYstWetqTFn5Au4m4GFg7xJaNVN2 | D69: 0.1 | E69: 0
A70: 2018-10-15 | B70: PT08H03M13S | C70: 1BvBMSEYstWetqTFn5Au4m4GFg7xJaNVN2 | D70: 0.00891657 | E70: 0
A71: 2018-10-15 | B71: PT15H14M18S | C71: 1BvBMSEYstWetqTFn5Au4m4GFg7xJaNVN2 | D71: 0.001 | E71: 0
A72: 2018-10-15 | B72: PT18H41M07S | C72: 1BvBMSEYstWetqTFn5Au4m4GFg7xJaNVN2 | D72: 0.00075595 | E72: 0
A73: 2018-10-15 | B73: PT19H17M17S | C73: 1BvBMSEYstWetqTFn5Au4m4GFg7xJaNVN2 | D73: 0.00156121 | E73: 0
A74: 2018-10-15 | B74: PT19H36M10S | C74: 1BvBMSEYstWetqTFn5Au4m4GFg7xJaNVN2 | D74: 0.00684 | E74: 0
A75: 2018-10-15 | B75: PT22H53M11S | C75: 1BvBMSEYstWetqTFn5Au4m4GFg7xJaNVN2 | D75: 0.00046619 | E75: 0
A76: 2018-10-16 | B76: PT00H21M43S | C76: 1BvBMSEYstWetqTFn5Au4m4GFg7xJaNVN2 | D76: 0.004 | E76: 0
A77: 2018-10-16 | B77: PT01H19M37S | C77: 1BvBMSEYstWetqTFn5Au4m4GFg7xJaNVN2 | D77: 0.001 | E77: 0
A78: 2018-10-16 | B78: PT02H11M32S | C78: 1BvBMSEYstWetqTFn5Au4m4GFg7xJaNVN2 | D78: 0.0090596 | E78: 0
A79: 2018-10-16 | B79: PT05H10M46S | C79: 1BvBMSEYstWetqTFn5Au4m4GFg7xJaNVN2 | D79: 0.00383502 | E79: 0
A80: 2018-10-16 | B80: PT05H57M57S | C80: 1BvBMSEYstWetqTFn5Au4m4GFg7xJaNVN2 | D80: 0.0018501 | E80: 0
A81: 2018-10-16 | B81: PT10H22M40S | C81: 1BvBMSEYstWetqTFn5Au4m4GFg7xJaNVN2 | D81: 0.01 | E81: 0
A82: 2018-10-16 | B82: PT11H14M00S | C82: 1BvBMSEYstWetqTFn5Au4m4GFg7xJaNVN2 | D82: 0.0018 | E82: 0
A83: 2018-10-16 | B83: PT12H57M31S | C83: 1BvBMSEYstWetqTFn5Au4m4GFg7xJaNVN2 | D83: 0.0015 | E83: 0
A84: 2018-10-16 | B84: PT14H21M19S | C84: 1BvBMSEYstWetqTFn5Au4m4GFg7xJaNVN2 | D84: 0.00821152 | E84: 0
A85: 2018-10-16 | B85: PT15H51M17S | C85: 1BvBMSEYstWetqTFn5Au4m4GFg7xJaNVN2 | D85: 0.00445075 | E85: 0
A86: 2018-10-16 | B86: PT18H05M47S | C86: 1BvBMSEYstWetqTFn5Au4m4GFg7xJaNVN2 | D86: 0.003 | E86: 0
A87: 2018-10-16 | B87: PT18H29M37S | C87: 1BvBMSEYstWetqTFn5Au4m4GFg7xJaNVN2 | D87: 0.0046 | E87: 0
A88: 2018-10-16 | B88: PT18H54M55S | C88: 1BvBMSEYstWetqTFn5Au4m4GFg7xJaNVN2 | D88: 0.0095 | E88: 0
A89: 2018-10-16 | B89: PT22H01M35S | C89: 1BvBMSEYstWetqTFn5Au4m4GFg7xJaNVN2 | D89: 0.002 | E89: 0
A90: 2018-10-16 | B90: PT23H30M29S | C90: 1BvBMSEYstWetqTFn5Au4m4GFg7xJaNVN2 | D90: 0.00100402 | E90: 0
A91: 2018-10-17 | B91: PT00H31M21S | C91: 1BvBMSEYstWetqTFn5Au4m4GFg7xJaNVN2 | D91: 0.00196248 | E91: 0
A92: 2018-10-17 | B92: PT01H14M09S | C92: 1BvBMSEYstWetqTFn5Au4m4GFg7xJaNVN2 | D92: 0.00077335 | E92: 0
A93: 2018-10-17 | B93: PT11H44M43S | C93: 1BvBMSEYstWetqTFn5Au4m4GFg7xJaNVN2 | D93: 0.00075715 | E93: 0
A94: 2018-10-17 | B94: PT13H21M32S | C94: 1BvBMSEYstWetqTFn5Au4m4GFg7xJaNVN2 | D94: 0.00022482 | E94: 0
A95: 2018-10-17 | B95: PT13H54M14S | C95: 1BvBMSEYstWetqTFn5Au4m4GFg7xJaNVN2 | D95: 0.0023 | E95: 0
A96: 2018-10-17 | B96: PT14H00M29S | C96: 1BvBMSEYstWetqTFn5Au4m4GFg7xJaNVN2 | D96: 0.00104304 | E96: 0
A97: 2018-10-17 | B97: PT17H00M35S | C97: 1BvBMSEYstWetqTFn5Au4m4GFg7xJaNVN2 | D97: 0.2 | E97: 0
A98: 2018-10-17 | B98: PT17H22M14S | C98: 1BvBMSEYstWetqTFn5Au4m4GFg7xJaNVN2 | D98: 0.00088578 | E98: 0
A99: 2018-10-17 | B99: PT21H12M13S | C99: 1BvBMSEYstWetqTFn5Au4m4GFg7xJaNVN2 | D99: 0.0009 | E99: 0
A100: 2018-10-17 | B100: PT21H29M44S | C100: 1BvBMSEYstWetqTFn5Au4m4GFg7xJaNVN2 | D100: 0.01 | E100: 0
A101: 2018-10-17 | B101: PT22H58M59S | C101: 1BvBMSEYstWetqTFn5Au4m4GFg7xJaNVN2 | D101: 0.00136034 | E101: 0
A102: 2018-10-18 | B102: PT00H45M17S | C102: 1BvBMSEYstWetqTFn5Au4m4GFg7xJaNVN2 | D102: 0.00090977 | E102: 0
A103: 2018-10-18 | B103: PT09H20M40S | C103: 1BvBMSEYstWetqTFn5Au4m4GFg7xJaNVN2 | D103: 0.0020808 | E103: 0
A104: 2018-10-18 | B104: PT18H21M34S | C104: 1BvBMSEYstWetqTFn5Au4m4GFg7xJaNVN2 | D104: 0.003 | E104: 0
A105: 2018-10-18 | B105: PT19H32M25S | C105: 1BvBMSEYstWetqTFn5Au4m4GFg7xJaNVN2 | D105: 0.01 | E105: 0
A106: 2018-10-18 | B106: PT19H57M50S | C106: 1BvBMSEYstWetqTFn5Au4m4GFg7xJaNVN2 | D106: 0.00281253 | E106: 0
A107: 2018-10-19 | B107: PT06H25M25S | C107: 1BvBMSEYstWetqTFn5Au4m4GFg7xJaNVN2 | D107: 0.001 | E107: 0
A108: 2018-10-19 | B108: PT06H28M00S | C108: 1BvBMSEYstWetqTFn5Au4m4GFg7xJaNVN2 | D108: 0.00309256 | E108: 0
A109: 2018-10-19 | B109: PT16H05M24S | C109: 1BvBMSEYstWetqTFn5Au4m4GFg7xJaNVN2 | D109: 0.00096419 | E109: 0
A110: 2018-10-19 | B110: PT17H18M35S | C110: 1BvBMSEYstWetqTFn5Au4m4GFg7xJaNVN2 | D110: 0.00154589 | E110: 0
A111: 2018-10-19 | B111: PT18H25M22S | C111: 1BvBMSEYstWetqTFn5Au4m4GFg7xJaNVN2 | D111: 0.00156396 | E111: 0
A112: 2018-10-19 | B112: PT21H21M23S | C112: 1BvBMSEYstWetqTFn5Au4m4GFg7xJaNVN2 | D112: 0.001791 | E112: 0
A113: 2018-10-19 | B113: PT21H33M42S | C113: 1BvBMSEYstWetqTFn5Au4m4GFg7xJaNVN2 | D113: 0.0000775 | E113: 0
A114: 2018-10-19 | B114: PT22H49M34S | C114: 1BvBMSEYstWetqTFn5Au4m4GFg7xJaNVN2 | D114: 0.003 | E114: 0
A115: 2018-10-20 | B115: PT00H44M39S | C115: 1BvBMSEYstWetqTFn5Au4m4GFg7xJaNVN2 | D115: 0.00092986 | E115: 0
A116: 2018-10-20 | B116: PT01H22M48S | C116: 1BvBMSEYstWetqTFn5Au4m4GFg7xJaNVN2 | D116: 0.005 | E116: 0
A117: 2018-10-20 | B117: PT04H53M32S | C117: 1BvBMSEYstWetqTFn5Au4m4GFg7xJaNVN2 | D117: 0.00118004 | E117: 0
A118: 2018-10-20 | B118: PT07H53M15S | C118: 1BvBMSEYstWetqTFn5Au4m4GFg7xJaNVN2 | D118: 0.00092035 | E118: 0
A119: 2018-10-20 | B119: PT08H11M32S | C119: 1BvBMSEYstWetqTFn5Au4m4GFg7xJaNVN2 | D119: 0.01 | E119: 0
A120: 2018-10-20 | B120: PT09H15M50S | C120: 1BvBMSEYstWetqTFn5Au4m4GFg7xJaNVN2 | D120: 0.0001 | E120: 0
A121: 2018-10-20 | B121: PT11H21M17S | C121: 1BvBMSEYstWetqTFn5Au4m4GFg7xJaNVN2 | D121: 0.015625 | E121: 0
A122: 2018-10-20 | B122: PT22H36M42S | C122: 1BvBMSEYstWetqTFn5Au4m4GFg7xJaNVN2 | D122: 0.0078 | E122: 0
A123: 2018-10-21 | B123: PT08H53M58S | C123: 1BvBMSEYstWetqTFn5Au4m4GFg7xJaNVN2 | D123: 0.00612408 | E123: 0
A124: 2018-10-21 | B124: PT14H14M08S | C124: 1BvBMSEYstWetqTFn5Au4m4GFg7xJaNVN2 | D124: 0.00087984 | E124: 0
A125: 2018-10-21 | B125: PT14H55M34S | C125: 1BvBMSEYstWetqTFn5Au4m4GFg7xJaNVN2 | D125: 0.0011 | E125: 0
A126: 2018-10-21 | B126: PT20H51M06S | C126: 1BvBMSEYstWetqTFn5Au4m4GFg7xJaNVN2 | D126: 0.00176232 | E126: 0
A127: 2018-10-22 | B127: PT04H19M08S | C127: 1BvBMSEYstWetqTFn5Au4m4GFg7xJaNVN2 | D127: 0.004 | E127: 0
A128: 2018-10-22 | B128: PT10H27M30S | C128: 1BvBMSEYstWetqTFn5Au4m4GFg7xJaNVN2 | D128: 0.19 | E128: 0
A129: 2018-10-22 | B129: PT10H37M44S | C129: 1BvBMSEYstWetqTFn5Au4m4GFg7xJaNVN2 | D129: 0.00177455 | E129: 0
A130: 2018-10-22 | B130: PT12H12M14S | C130: 1BvBMSEYstWetqTFn5Au4m4GFg7xJaNVN2 | D130: 0.003 | E130: 0
A131: 2018-10-22 | B131: PT13H56M51S | C131: 1BvBMSEYstWetqTFn5Au4m4GFg7xJaNVN2 | D131: 0.00077072 | E131: 0
A132: 2018-10-22 | B132: PT19H55M14S | C132: 1BvBMSEYstWetqTFn5Au4m4GFg7xJaNVN2 | D132: 0.002 | E132: 0
A133: 2018-10-22 | B133: PT20H52M04S | C133: 1BvBMSEYstWetqTFn5Au4m4GFg7xJaNVN2 | D133: 0.0015 | E133: 0
A134: 2018-10-23 | B134: PT08H01M11S | C134: 1BvBMSEYstWetqTFn5Au4m4GFg7xJaNVN2 | D134: 0.00104682 | E134: 0
A135: 2018-10-23 | B135: PT14H44M16S | C135: 1BvBMSEYstWetqTFn5Au4m4GFg7xJaNVN2 | D135: 0.00067635 | E135: 0
A136: 2018-10-23 | B136: PT19H34M05S | C136: 1BvBMSEYstWetqTFn5Au4m4GFg7xJaNVN2 | D136: 0.01132307 | E136: 0
A137: 2018-10-24 | B137: PT00H22M31S | C137: 1BvBMSEYstWetqTFn5Au4m4GFg7xJaNVN2 | D137: 0.01 | E137: 0
A138: 2018-10-24 | B138: PT03H00M08S | C138: 1BvBMSEYstWetqTFn5Au4m4GFg7xJaNVN2 | D138: 0.00156121 | E138: 0
A139: 2018-10-24 | B139: PT07H39M53S | C139: 1BvBMSEYstWetqTFn5Au4m4GFg7xJaNVN2 | D139: 0.017 | E139: 0
A140: 2018-10-24 | B140: PT11H57M05S | C140: 1BvBMSEYstWetqTFn5Au4m4GFg7xJaNVN2 | D140: 0.00087427 | E140: 0
A141: 2018-10-24 | B141: PT20H32M50S | C141: 1BvBMSEYstWetqTFn5Au4m4GFg7xJaNVN2 | D141: 0.00154 | E141: 0
A142: 2018-10-24 | B142: PT21H24M53S | C142: 1BvBMSEYstWetqTFn5Au4m4GFg7xJaNVN2 | D142: 0.00088518 | E142: 0
A143: 2018-10-25 | B143: PT05H55M40S | C143: 1BvBMSEYstWetqTFn5Au4m4GFg7xJaNVN2 | D143: 0.00113599 | E143: 0
A144: 2018-10-25 | B144: PT06H38M41S | C144: 1BvBMSEYstWetqTFn5Au4m4GFg7xJaNVN2 | D144: 0.002 | E144: 0
A145: 2018-10-25 | B145: PT10H20M36S | C145: 1BvBMSEYstWetqTFn5Au4m4GFg7xJaNVN2 | D145: 0.001 | E145: 0
A146: 2018-10-25 | B146: PT12H06M19S | C146: 1BvBMSEYstWetqTFn5Au4m4GFg7xJaNVN2 | D146: 0.00689667 | E146: 0
A147: 2018-10-25 | B147: PT12H06M21S | C147: 1BvBMSEYstWetqTFn5Au4m4GFg7xJaNVN2 | D147: 0.03085395 | E147: 0
A148: 2018-10-25 | B148: PT19H55M46S | C148: 1BvBMSEYstWetqTFn5Au4m4GFg7xJaNVN2 | D148: 0.02 | E148: 0
A149: 2018-10-25 | B149: PT23H05M16S | C149: 1BvBMSEYstWetqTFn5Au4m4GFg7xJaNVN2 | D149: 0.001 | E149: 0
A150: 2018-10-25 | B150: PT23H30M46S | C150: 1BvBMSEYstWetqTFn5Au4m4GFg7xJaNVN2 | D150: 0.001 | E150: 0
A151: 2018-10-26 | B151: PT14H39M52S | C151: 1BvBMSEYstWetqTFn5Au4m4GFg7xJaNVN2 | D151: 0.0015636 | E151: 0
A152: 2018-10-26 | B152: PT15H21M26S | C152: 1BvBMSEYstWetqTFn5Au4m4GFg7xJaNVN2 | D152: 0.0008772 | E152: 0
A153: 2018-10-26 | B153: PT16H21M28S | C153: 1BvBMSEYstWetqTFn5Au4m4GFg7xJaNVN2 | D153: 0.001 | E153: 0
A154: 2018-10-26 | B154: PT16H31M47S | C154: 1BvBMSEYstWetqTFn5Au4m4GFg7xJaNVN2 | D154: 0.00106809 | E154: 0
A155: 2018-10-26 | B155: PT18H49M13S | C155: 1BvBMSEYstWetqTFn5Au4m4GFg7xJaNVN2 | D155: 0.00159 | E155: 0
A156: 2018-10-27 | B156: PT07H48M01S | C156: 1BvBMSEYstWetqTFn5Au4m4GFg7xJaNVN2 | D156: 0.0038 | E156: 0
A157: 2018-10-27 | B157: PT08H54M42S | C157: 1BvBMSEYstWetqTFn5Au4m4GFg7xJaNVN2 | D157: 0.00199808 | E157: 0
A158: 2018-10-27 | B158: PT10H03M11S | C158: 1BvBMSEYstWetqTFn5Au4m4GFg7xJaNVN2 | D158: 0.00779794 | E158: 0
A159: 2018-10-27 | B159: PT12H24M48S | C159: 1BvBMSEYstWetqTFn5Au4m4GFg7xJaNVN2 | D159: 0.00143259 | E159: 0
A160: 2018-10-27 | B160: PT15H33M25S | C160: 1BvBMSEYstWetqTFn5Au4m4GFg7xJaNVN2 | D160: 0.00136431 | E160: 0
A161: 2018-10-27 | B161: PT16H10M30S | C161: 1BvBMSEYstWetqTFn5Au4m4GFg7xJaNVN2 | D161: 0.00027728 | E161: 0
A162: 2018-10-27 | B162: PT16H44M28S | C162: 1BvBMSEYstWetqTFn5Au4m4GFg7xJaNVN2 | D162: 0.002 | E162: 0
A163: 2018-10-27 | B163: PT22H20M51S | C163: 1BvBMSEYstWetqTFn5Au4m4GFg7xJaNVN2 | D163: 0.00559874 | E163: 0
A164: 2018-10-28 | B164: PT18H50M39S | C164: 1BvBMSEYstWetqTFn5Au4m4GFg7xJaNVN2 | D164: 0.005 | E164: 0
A165: 2018-10-28 | B165: PT19H34M35S | C165: 1BvBMSEYstWetqTFn5Au4m4GFg7xJaNVN2 | D165: 0.0009 | E165: 0
A166: 2018-10-28 | B166: PT21H22M17S | C166: 1BvBMSEYstWetqTFn5Au4m4GFg7xJaNVN2 | D166: 0.01 | E166: 0
A167: 2018-10-28 | B167: PT23H03M56S | C167: 1BvBMSEYstWetqTFn5Au4m4GFg7xJaNVN2 | D167: 0.00155329 | E167: 0
A168: 2018-10-29 | B168: PT04H14M11S | C168: 1BvBMSEYstWetqTFn5Au4m4GFg7xJaNVN2 | D168: 0.00102113 | E168: 0
A169: 2018-10-29 | B169: PT05H26M02S | C169: 1BvBMSEYstWetqTFn5Au4m4GFg7xJaNVN2 | D169: 0.1 | E169: 0
A170: 2018-10-29 | B170: PT21H22M19S | C170: 1BvBMSEYstWetqTFn5Au4m4GFg7xJaNVN2 | D170: 0.000016 | E170: 0
A171: 2018-10-29 | B171: PT23H42M16S | C171: 1BvBMSEYstWetqTFn5Au4m4GFg7xJaNVN2 | D171: 0.000802 | E171: 0
A172: 2018-10-30 | B172: PT03H13M43S | C172: 1BvBMSEYstWetqTFn5Au4m4GFg7xJaNVN2 | D172: 0.002 | E172: 0
A173: 2018-10-30 | B173: PT09H41M19S | C173: 1BvBMSEYstWetqTFn5Au4m4GFg7xJaNVN2 | D173: 0.00181758 | E173: 0
A174: 2018-10-30 | B174: PT12H23M48S | C174: 1BvBMSEYstWetqTFn5Au4m4GFg7xJaNVN2 | D174: 0.00158156 | E174: 0
A175: 2018-10-30 | B175: PT15H53M45S | C175: 1BvBMSEYstWetqTFn5Au4m4GFg7xJaNVN2 | D175: 0.000795 | E175: 0
A176: 2018-10-30 | B176: PT16H51M10S | C176: 1BvBMSEYstWetqTFn5Au4m4GFg7xJaNVN2 | D176: 0.00142409 | E176: 0
A177: 2018-10-30 | B177: PT20H22M59S | C177: 1BvBMSEYstWetqTFn5Au4m4GFg7xJaNVN2 | D177: 0.001 | E177: 0
A178: 2018-10-31 | B178: PT02H19M23S | C178: 1BvBMSEYstWetqTFn5Au4m4GFg7xJaNVN2 | D178: 0.00904607 | E178: 0
A179: 2018-10-31 | B179: PT13H44M44S | C179: 1BvBMSEYstWetqTFn5Au4m4GFg7xJaNVN2 | D179: 0.00035914 | E179: 0
A180: 2018-10-31 | B180: PT14H03M30S | C180: 1BvBMSEYstWetqTFn5Au4m4GFg7xJaNVN2 | D180: 0.00158761 | E180: 0
A181: 2018-10-31 | B181: PT17H05M57S | C181: 1BvBMSEYstWetqTFn5Au4m4GFg7xJaNVN2 | D181: 0.001585 | E181: 0
A182: 2018-11-01 | B182: PT05H16M11S | C182: 1BvBMSEYstWetqTFn5Au4m4GFg7xJaNVN2 | D182: 0.00158697 | E182: 0
A183: 2018-11-01 | B183: PT09H58M05S | C183: 1BvBMSEYstWetqTFn5Au4m4GFg7xJaNVN2 | D183: 0.001585 | E183: 0
A184: 2018-11-01 | B184: PT17H32M48S | C184: 1BvBMSEYstWetqTFn5Au4m4GFg7xJaNVN2 | D184: 0.00126 | E184: 0
A185: 2018-11-01 | B185: PT17H55M38S | C185: 1BvBMSEYstWetqTFn5Au4m4GFg7xJaNVN2 | D185: 0.0019 | E185: 0
A186: 2018-11-02 | B186: PT10H55M23S | C186: 1BvBMSEYstWetqTFn5Au4m4GFg7xJaNVN2 | D186: 0.00226884 | E186: 0
A187: 2018-11-02 | B187: PT11H50M19S | C187: 1BvBMSEYstWetqTFn5Au4m4GFg7xJaNVN2 | D187: 0.00203765 | E187: 0
A188: 2018-11-02 | B188: PT12H29M50S | C188: 1BvBMSEYstWetqTFn5Au4m4GFg7xJaNVN2 | D188: 0.00101833 | E188: 0
A189: 2018-11-02 | B189: PT12H37M11S | C189: 1BvBMSEYstWetqTFn5Au4m4GFg7xJaNVN2 | D189: 0.00180157 | E189: 0
A190: 2018-11-03 | B190: PT05H13M45S | C190: 1BvBMSEYstWetqTFn5Au4m4GFg7xJaNVN2 | D190: 0.000783 | E190: 0
A191: 2018-11-03 | B191: PT05H17M26S | C191: 1BvBMSEYstWetqTFn5Au4m4GFg7xJaNVN2 | D191: 0.00093942 | E191: 0
A192: 2018-11-03 | B192: PT12H23M08S | C192: 1BvBMSEYstWetqTFn5Au4m4GFg7xJaNVN2 | D192: 0.00157971 | E192: 0
A193: 2018-11-03 | B193: PT12H39M35S | C193: 1BvBMSEYstWetqTFn5Au4m4GFg7xJaNVN2 | D193: 0.01 | E193: 0
A194: 2018-11-03 | B194: PT12H52M46S | C194: 1BvBMSEYstWetqTFn5Au4m4GFg7xJaNVN2 | D194: 0.01 | E194: 0
A195: 2018-11-03 | B195: PT16H31M33S | C195: 1BvBMSEYstWetqTFn5Au4m4GFg7xJaNVN2 | D195: 0.00217775 | E195: 0
A196: 2018-11-03 | B196: PT19H19M48S | C196: 1BvBMSEYstWetqTFn5Au4m4GFg7xJaNVN2 | D196: 0.003 | E196: 0
A197: 2018-11-04 | B197: PT10H22M00S | C197: 1BvBMSEYstWetqTFn5Au4m4GFg7xJaNVN2 | D197: 0.00099087 | E197: 0
A198: 2018-11-04 | B198: PT13H41M11S | C198: 1BvBMSEYstWetqTFn5Au4m4GFg7xJaNVN2 | D198: 0.001 | E198: 0
A199: 2018-11-04 | B199: PT19H11M46S | C199: 1BvBMSEYstWetqTFn5Au4m4GFg7xJaNVN2 | D199: 0.00313739 | E199: 0
A200: 2018-11-05 | B200: PT16H59M50S | C200: 1BvBMSEYstWetqTFn5Au4m4GFg7xJaNVN2 | D200: 0.002 | E200: 0
A201: 2018-11-05 | B201: PT20H57M08S | C201: 1BvBMSEYstWetqTFn5Au4m4GFg7xJaNVN2 | D201: 0.002348 | E201: 0
A202: 2018-11-06 | B202: PT08H11M12S | C202: 1BvBMSEYstWetqTFn5Au4m4GFg7xJaNVN2 | D202: 0.01 | E202: 0
A203: 2018-11-06 | B203: PT10H07M01S | C203: 1BvBMSEYstWetqTFn5Au4m4GFg7xJaNVN2 | D203: 0.0015 | E203: 0
A204: 2018-11-06 | B204: PT15H38M10S | C204: 1BvBMSEYstWetqTFn5Au4m4GFg7xJaNVN2 | D204: 0.0157184 | E204: 0
A205: 2018-11-06 | B205: PT19H11M47S | C205: 1BvBMSEYstWetqTFn5Au4m4GFg7xJaNVN2 | D205: 0.003 | E205: 0
A206: 2018-11-07 | B206: PT05H52M28S | C206: 1BvBMSEYstWetqTFn5Au4m4GFg7xJaNVN2 | D206: 0.001 | E206: 0
A207: 2018-11-07 | B207: PT08H30M05S | C207: 1BvBMSEYstWetqTFn5Au4m4GFg7xJaNVN2 | D207: 0.0016 | E207: 0
A208: 2018-11-07 | B208: PT10H40M38S | C208: 1BvBMSEYstWetqTFn5Au4m4GFg7xJaNVN2 | D208: 0.00088064 | E208: 0
A209: 2018-11-07 | B209: PT17H33M48S | C209: 1BvBMSEYstWetqTFn5Au4m4GFg7xJaNVN2 | D209: 0.01752037 | E209: 0
A210: 2018-11-07 | B210: PT17H40M19S | C210: 1BvBMSEYstWetqTFn5Au4m4GFg7xJaNVN2 | D210: 0.005 | E210: 0
A211: 2018-11-07 | B211: PT20H54M02S | C211: 1BvBMSEYstWetqTFn5Au4m4GFg7xJaNVN2 | D211: 0.000849 | E211: 0
A212: 2018-11-08 | B212: PT14H18M11S | C212: 1BvBMSEYstWetqTFn5Au4m4GFg7xJaNVN2 | D212: 0.00154431 | E212: 0
A213: 2018-11-08 | B213: PT22H28M43S | C213: 1BvBMSEYstWetqTFn5Au4m4GFg7xJaNVN2 | D213: 0.0031 | E213: 0
A214: 2018-11-09 | B214: PT16H31M36S | C214: 1BvBMSEYstWetqTFn5Au4m4GFg7xJaNVN2 | D214: 0.0015756 | E214: 0
A215: 2018-11-10 | B215: PT07H10M46S | C215: 1BvBMSEYstWetqTFn5Au4m4GFg7xJaNVN2 | D215: 0.0015 | E215: 0
A216: 2018-11-10 | B216: PT08H23M52S | C216: 1BvBMSEYstWetqTFn5Au4m4GFg7xJaNVN2 | D216: 0.003 | E216: 0
A217: 2018-11-10 | B217: PT19H08M23S | C217: 1BvBMSEYstWetqTFn5Au4m4GFg7xJaNVN2 | D217: 0.00157257 | E217: 0
A218: 2018-11-10 | B218: PT19H45M17S | C218: 1BvBMSEYstWetqTFn5Au4m4GFg7xJaNVN2 | D218: 0.00003054 | E218: 0
A219: 2018-11-10 | B219: PT20H13M48S | C219: 1BvBMSEYstWetqTFn5Au4m4GFg7xJaNVN2 | D219: 0.00176834 | E219: 0
A220: 2018-11-10 | B220: PT20H19M46S | C220: 1BvBMSEYstWetqTFn5Au4m4GFg7xJaNVN2 | D220: 0.00739264 | E220: 0
A221: 2018-11-11 | B221: PT07H46M30S | C221: 1BvBMSEYstWetqTFn5Au4m4GFg7xJaNVN2 | D221: 0.00198944 | E221: 0
A222: 2018-11-11 | B222: PT11H03M18S | C222: 1BvBMSEYstWetqTFn5Au4m4GFg7xJaNVN2 | D222: 0.00321375 | E222: 0
A223: 2018-11-13 | B223: PT07H41M34S | C223: 1BvBMSEYstWetqTFn5Au4m4GFg7xJaNVN2 | D223: 0.00387192 | E223: 0
A224: 2018-11-13 | B224: PT15H56M42S | C224: 1BvBMSEYstWetqTFn5Au4m4GFg7xJaNVN2 | D224: 0.001 | E224: 0
A225: 2018-11-13 | B225: PT19H17M47S | C225: 1BvBMSEYstWetqTFn5Au4m4GFg7xJaNVN2 | D225: 0.01 | E225: 0
A226: 2018-11-14 | B226: PT00H37M44S | C226: 1BvBMSEYstWetqTFn5Au4m4GFg7xJaNVN2 | D226: 0.0008 | E226: 0
A227: 2018-11-14 | B227: PT03H40M41S | C227: 1BvBMSEYstWetqTFn5Au4m4GFg7xJaNVN2 | D227: 0.01 | E227: 0
A228: 2018-11-14 | B228: PT10H10M39S | C228: 1BvBMSEYstWetqTFn5Au4m4GFg7xJaNVN2 | D228: 0.00814 | E228: 0
A229: 2018-11-14 | B229: PT13H27M46S | C229: 1BvBMSEYstWetqTFn5Au4m4GFg7xJaNVN2 | D229: 0.00164579 | E229: 0
A230: 2018-11-14 | B230: PT14H45M07S | C230: 1BvBMSEYstWetqTFn5Au4m4GFg7xJaNVN2 | D230: 0.00081134 | E230: 0
A231: 2018-11-14 | B231: PT20H19M28S | C231: 1BvBMSEYstWetqTFn5Au4m4GFg7xJaNVN2 | D231: 0.1 | E231: 0
A232: 2018-11-15 | B232: PT02H02M19S | C232: 1BvBMSEYstWetqTFn5Au4m4GFg7xJaNVN2 | D232: 0.00107104 | E232: 0
D233: of:=SUM([.D1:.D232]) -> 1.66600174 | E233: of:=COUNT([.E1:.E232]) -> 232